{
  "version": "1.0.0",
  "updatedAt": "2026-06-05",
  "sourceConfidence": "needs-verification",
  "defaultLocale": "en",
  "locales": [
    "en",
    "rw"
  ],
  "notes": "Unified from the Claude Design prototype (_source/design-dataset.js) into the canonical schema. 6 journeys. Fees/timelines/rules are MODELED, not verified (D6: domain reviewers). English strings are inline here (source); Kinyarwanda lives in locales/rw.json (D7).",
  "agencies": [
    {
      "id": "self",
      "name": "You",
      "short": "YOU",
      "color": "#64748B",
      "where": "You arrange this yourself",
      "type": "self"
    },
    {
      "id": "nida",
      "name": "NIDA",
      "short": "ID",
      "color": "#2563EB",
      "where": "Online on Irembo (NIDA)",
      "type": "national"
    },
    {
      "id": "rdb",
      "name": "RDB",
      "short": "RDB",
      "color": "#0E9488",
      "where": "Online on Irembo (RDB)",
      "type": "national"
    },
    {
      "id": "rra",
      "name": "RRA",
      "short": "RRA",
      "color": "#D97706",
      "where": "Online on Irembo (RRA)",
      "type": "national"
    },
    {
      "id": "district",
      "name": "District",
      "short": "DIST",
      "color": "#16A34A",
      "where": "At your District office",
      "type": "local-government"
    },
    {
      "id": "health",
      "name": "Health regulator",
      "short": "HLTH",
      "color": "#E11D48",
      "where": "Health inspection visit",
      "type": "sector-regulator"
    },
    {
      "id": "rssb",
      "name": "RSSB",
      "short": "RSSB",
      "color": "#7C3AED",
      "where": "Online on Irembo (RSSB)",
      "type": "national"
    },
    {
      "id": "bank",
      "name": "Bank",
      "short": "BANK",
      "color": "#4F46E5",
      "where": "At your bank",
      "type": "financial"
    },
    {
      "id": "rlmua",
      "name": "RLMUA (Land)",
      "short": "LAND",
      "color": "#B45309",
      "where": "Online on Irembo (Land)",
      "type": "national"
    },
    {
      "id": "notary",
      "name": "Notary",
      "short": "NOT",
      "color": "#0891B2",
      "where": "At a notary",
      "type": "external"
    },
    {
      "id": "civil",
      "name": "Civil Registrar",
      "short": "CIV",
      "color": "#059669",
      "where": "At your Sector office",
      "type": "local-government"
    },
    {
      "id": "police",
      "name": "Rwanda Police",
      "short": "RNP",
      "color": "#1E3A8A",
      "where": "Rwanda Police",
      "type": "national"
    },
    {
      "id": "immigration",
      "name": "Immigration (DGIE)",
      "short": "IMM",
      "color": "#9333EA",
      "where": "Immigration office (DGIE)",
      "type": "national"
    },
    {
      "id": "court",
      "name": "Court",
      "short": "COURT",
      "color": "#475569",
      "where": "At your local court",
      "type": "judicial"
    }
  ],
  "artifacts": [
    {
      "id": "national-id",
      "name": "Valid National ID",
      "bring": true,
      "issuedBy": "nida"
    },
    {
      "id": "structure-decision",
      "name": "Structure decision",
      "bring": false,
      "issuedBy": "self"
    },
    {
      "id": "premises-proof",
      "name": "Lease or land title for premises",
      "bring": true,
      "issuedBy": "self"
    },
    {
      "id": "name-reservation",
      "name": "Reserved business name",
      "bring": false,
      "issuedBy": "rdb"
    },
    {
      "id": "certificate",
      "name": "Certificate of registration",
      "bring": false,
      "issuedBy": "rdb"
    },
    {
      "id": "tin",
      "name": "TIN (tax number)",
      "bring": false,
      "issuedBy": "rdb"
    },
    {
      "id": "vat",
      "name": "VAT registration",
      "bring": false,
      "issuedBy": "rra"
    },
    {
      "id": "trading-license",
      "name": "Trading license",
      "bring": false,
      "issuedBy": "district"
    },
    {
      "id": "hygiene",
      "name": "Health / hygiene permit",
      "bring": false,
      "issuedBy": "health"
    },
    {
      "id": "rssb-reg",
      "name": "RSSB registration",
      "bring": false,
      "issuedBy": "rssb"
    },
    {
      "id": "bank-account",
      "name": "Business bank account",
      "bring": false,
      "issuedBy": "bank"
    },
    {
      "id": "ebm",
      "name": "EBM e-invoicing device",
      "bring": false,
      "issuedBy": "rra"
    },
    {
      "id": "land-title",
      "name": "Seller's land title (UPI)",
      "bring": true,
      "issuedBy": "rlmua"
    },
    {
      "id": "encumbrance",
      "name": "Encumbrance clearance",
      "bring": false,
      "issuedBy": "rlmua"
    },
    {
      "id": "mortgage-release",
      "name": "Mortgage release / consent",
      "bring": true,
      "issuedBy": "bank"
    },
    {
      "id": "spousal-consent",
      "name": "Spouse's consent",
      "bring": true,
      "issuedBy": "notary"
    },
    {
      "id": "coowner-consent",
      "name": "Co-owner / family consent",
      "bring": true,
      "issuedBy": "notary"
    },
    {
      "id": "tax-clearance",
      "name": "Land tax clearance",
      "bring": false,
      "issuedBy": "rra"
    },
    {
      "id": "sale-agreement",
      "name": "Notarized sale agreement",
      "bring": false,
      "issuedBy": "notary"
    },
    {
      "id": "transfer-payment",
      "name": "Transfer fee payment",
      "bring": false,
      "issuedBy": "rra"
    },
    {
      "id": "new-title",
      "name": "New land title",
      "bring": false,
      "issuedBy": "rlmua"
    },
    {
      "id": "hospital-notice",
      "name": "Hospital birth notification",
      "bring": true,
      "issuedBy": "health"
    },
    {
      "id": "home-witnesses",
      "name": "Home-birth witnesses & cell confirmation",
      "bring": true,
      "issuedBy": "civil"
    },
    {
      "id": "parents-ids",
      "name": "Both parents' National IDs",
      "bring": true,
      "issuedBy": "self"
    },
    {
      "id": "marriage-proof",
      "name": "Parents' marriage certificate",
      "bring": true,
      "issuedBy": "self"
    },
    {
      "id": "paternity-ack",
      "name": "Father's acknowledgement of paternity",
      "bring": false,
      "issuedBy": "civil"
    },
    {
      "id": "court-order",
      "name": "Court order for late registration",
      "bring": false,
      "issuedBy": "court"
    },
    {
      "id": "birth-declaration",
      "name": "Birth declaration",
      "bring": false,
      "issuedBy": "civil"
    },
    {
      "id": "birth-certificate",
      "name": "Birth certificate",
      "bring": false,
      "issuedBy": "civil"
    },
    {
      "id": "passport-type",
      "name": "Chosen passport type & application",
      "bring": false,
      "issuedBy": "immigration"
    },
    {
      "id": "minor-docs",
      "name": "Child's documents & guardian consent",
      "bring": true,
      "issuedBy": "self"
    },
    {
      "id": "old-passport",
      "name": "Surrendered old passport",
      "bring": true,
      "issuedBy": "immigration"
    },
    {
      "id": "passport-payment",
      "name": "Passport fee payment",
      "bring": false,
      "issuedBy": "immigration"
    },
    {
      "id": "biometrics",
      "name": "Biometric enrolment",
      "bring": false,
      "issuedBy": "immigration"
    },
    {
      "id": "passport-approval",
      "name": "Vetted & printed passport",
      "bring": false,
      "issuedBy": "immigration"
    },
    {
      "id": "passport",
      "name": "Passport",
      "bring": false,
      "issuedBy": "immigration"
    },
    {
      "id": "license-category",
      "name": "Chosen licence category",
      "bring": false,
      "issuedBy": "police"
    },
    {
      "id": "foreign-convert",
      "name": "Verified foreign licence",
      "bring": true,
      "issuedBy": "self"
    },
    {
      "id": "medical-cert",
      "name": "Medical fitness certificate",
      "bring": false,
      "issuedBy": "health"
    },
    {
      "id": "provisional",
      "name": "Provisional (theory) pass",
      "bring": false,
      "issuedBy": "police"
    },
    {
      "id": "practical-pass",
      "name": "Practical exam pass",
      "bring": false,
      "issuedBy": "police"
    },
    {
      "id": "license-payment",
      "name": "Driving licence fee payment",
      "bring": false,
      "issuedBy": "police"
    },
    {
      "id": "driving-license",
      "name": "Driving license",
      "bring": false,
      "issuedBy": "police"
    },
    {
      "id": "celibacy-cert",
      "name": "Certificate of celibacy",
      "bring": false,
      "issuedBy": "civil"
    },
    {
      "id": "prior-marriage-proof",
      "name": "Divorce decree / spouse's death certificate",
      "bring": true,
      "issuedBy": "civil"
    },
    {
      "id": "foreigner-impediment",
      "name": "Certificate of no impediment",
      "bring": true,
      "issuedBy": "immigration"
    },
    {
      "id": "matrimonial-regime",
      "name": "Chosen matrimonial property regime",
      "bring": false,
      "issuedBy": "notary"
    },
    {
      "id": "marriage-witnesses",
      "name": "Two witnesses",
      "bring": true,
      "issuedBy": "self"
    },
    {
      "id": "marriage-booking",
      "name": "Civil marriage booking",
      "bring": false,
      "issuedBy": "civil"
    },
    {
      "id": "marriage-certificate",
      "name": "Marriage certificate",
      "bring": false,
      "issuedBy": "civil"
    }
  ],
  "services": [
    {
      "id": "choose-structure",
      "name": "Decide legal structure",
      "short": "Legal structure",
      "agency": "self",
      "desc": "Sole proprietor (just you) vs a company with partners. This quietly changes several later steps.",
      "requires": [],
      "produces": [
        "structure-decision"
      ],
      "cost": {
        "model": "free"
      },
      "duration": {
        "min": 5,
        "max": 30,
        "unit": "min"